<?xml version="1.0" encoding="UTF-8"?>
<!ELEMENT deportistas (deportista+)>
<!ELEMENT deportista (deporte+, nombre)>
<!ELEMENT deporte (#PCDATA)>
<!ELEMENT nombre (#PCDATA)>
